{
  "last_updated": 1793244703,
  "supported_protocols": [
    "openai"
  ],
  "model_id": "bedrock/us-east-1/meta.llama3-8b-instruct-v1:0",
  "display_name": "Llama 3 8B Instruct",
  "canonical_model": "meta.llama3-8b-instruct-v1:0",
  "family": "llama",
  "version": "3",
  "capabilities": [
    "text"
  ],
  "max_input_tokens": 8192,
  "context_window": 8192,
  "max_output_tokens": 8192,
  "official": false,
  "thinking_supported": false,
  "thinking_toggleable": false,
  "price": {
    "currency": "USD",
    "input": 3e-07,
    "output": 6e-07
  }
}
