{
  "last_updated": 1793244705,
  "supported_protocols": [
    "anthropic",
    "gemini",
    "openai"
  ],
  "model_id": "deepseek-v4-pro",
  "display_name": "DeepSeek V4 Pro",
  "canonical_model": "deepseek-v4-pro",
  "family": "deepseek",
  "version": "4",
  "capabilities": [
    "text"
  ],
  "max_input_tokens": 1048576,
  "max_output_tokens": 393216,
  "context_window": 1048576,
  "official": false,
  "thinking_supported": true,
  "thinking_toggleable": true,
  "price": {
    "currency": "USD",
    "input": 6.6e-07,
    "output": 1.98e-06,
    "cache_read": 2.2e-08
  }
}
