{
  "last_updated": 1793244702,
  "supported_protocols": [
    "anthropic",
    "gemini",
    "openai"
  ],
  "model_id": "mercury-2.5-preview",
  "canonical_model": "mercury-2.5-preview",
  "version": "2.5",
  "family": "mercury",
  "display_name": "Mercury 2.5 Preview",
  "max_output_tokens": 65536,
  "context_window": 260000,
  "capabilities": [
    "text",
    "tool_use",
    "reasoning"
  ],
  "thinking_supported": true,
  "max_input_tokens": 260000,
  "official": false,
  "price": {
    "currency": "USD",
    "input": 2e-07,
    "output": 7.5e-07,
    "cache_read": 2e-08
  }
}
