{
  "last_updated": 1793244705,
  "supported_protocols": [
    "openai"
  ],
  "model_id": "vertex_ai/codestral-2501",
  "display_name": "Aihubmix Codestral 2501",
  "canonical_model": "codestral-2501",
  "family": "codestral",
  "version": "2",
  "capabilities": [
    "text",
    "tool_use"
  ],
  "max_input_tokens": 128000,
  "context_window": 128000,
  "max_output_tokens": 128000,
  "official": false,
  "thinking_supported": false,
  "thinking_toggleable": false,
  "price": {
    "currency": "USD",
    "input": 2e-07,
    "output": 6e-07
  }
}
