{
  "last_updated": 1793244704,
  "supported_protocols": [
    "openai"
  ],
  "model_id": "stability/sd3.5-large",
  "canonical_model": "sd3.5-large",
  "family": "stable",
  "version": "3.5",
  "capabilities": [
    "text_to_image"
  ],
  "official": false,
  "price": {
    "currency": "USD",
    "unit": "image",
    "unit_price": 0.065
  }
}
