{
  "last_updated": 1793244703,
  "supported_protocols": [
    "anthropic",
    "gemini",
    "openai"
  ],
  "model_id": "glm-5.3-flashx",
  "display_name": "GLM-5.3-FlashX",
  "canonical_model": "glm-5.3-flashx",
  "family": "glm",
  "version": "5.3",
  "thinking_supported": true,
  "thinking_toggleable": false,
  "capabilities": [
    "text",
    "vision",
    "tool_use",
    "reasoning"
  ],
  "max_input_tokens": 1048576,
  "max_output_tokens": 131072,
  "context_window": 1048576,
  "official": false,
  "price": {
    "currency": "USD",
    "input": 2.898550725e-07,
    "output": 1.014492754e-06,
    "cache_read": 8.26086957e-08
  }
}
