{
  "last_updated": 1793244703,
  "supported_protocols": [
    "anthropic"
  ],
  "model_id": "claude-haiku-4-5",
  "display_name": "Claude Haiku 4.5",
  "canonical_model": "claude-haiku-4-5",
  "family": "claude",
  "version": "4.5",
  "capabilities": [
    "text"
  ],
  "context_window": 200000,
  "max_input_tokens": 200000,
  "official": false,
  "thinking_supported": true,
  "thinking_toggleable": true,
  "price": {
    "currency": "CNY",
    "input": 1e-08,
    "output": 1e-08
  }
}
