{
  "model_id": "openai/gpt-5",
  "display_name": "OpenAI: GPT-5",
  "canonical_model": "gpt-5",
  "family": "gpt",
  "version": "5",
  "max_input_tokens": 400000,
  "context_window": 400000,
  "official": true,
  "max_output_tokens": 128000,
  "thinking_supported": true,
  "price": {
    "currency": "USD",
    "input": 1.25e-06,
    "output": 1e-05,
    "cache_read": 1.25e-07
  },
  "last_updated": 1793244705,
  "supported_protocols": [
    "anthropic",
    "openai"
  ],
  "capabilities": [
    "reasoning",
    "text",
    "tool_use",
    "vision"
  ]
}
