{
  "last_updated": 1793244704,
  "supported_protocols": [
    "openai"
  ],
  "model_id": "replicate/deepseek-ai/deepseek-r1",
  "display_name": "DeepSeek: R1",
  "canonical_model": "DeepSeek-R1",
  "family": "deepseek",
  "version": "r1",
  "capabilities": [
    "text",
    "reasoning"
  ],
  "max_input_tokens": 65536,
  "context_window": 65536,
  "max_output_tokens": 8192,
  "official": false,
  "thinking_supported": true,
  "thinking_toggleable": true,
  "price": {
    "currency": "USD",
    "input": 3.75e-06,
    "output": 1e-05
  }
}
