{
  "last_updated": 1793289610,
  "supported_protocols": [
    "anthropic",
    "openai",
    "openai_responses"
  ],
  "model_id": "seed-2-0-lite-260228",
  "canonical_model": "seed-2-0-lite-260228",
  "family": "seed",
  "version": "2.0",
  "capabilities": [
    "text"
  ],
  "max_input_tokens": 229376,
  "max_output_tokens": 131072,
  "context_window": 262144,
  "official": true,
  "price": {
    "currency": "USD",
    "input": 2.5e-07,
    "output": 2e-06,
    "cache_read": 5e-08,
    "context_tiers": [
      {
        "min_tokens": 131073,
        "input": 5e-07,
        "output": 4e-06,
        "cache_read": 1e-07
      }
    ]
  }
}
