{
  "last_updated": 1793244704,
  "supported_protocols": [
    "openai"
  ],
  "model_id": "novita/deepseek/deepseek-v3/community",
  "canonical_model": "community",
  "capabilities": [
    "text",
    "tool_use"
  ],
  "max_input_tokens": 64000,
  "context_window": 64000,
  "max_output_tokens": 8000,
  "official": false,
  "thinking_supported": true,
  "thinking_toggleable": true,
  "price": {
    "currency": "USD",
    "input": 8.900000000000001e-07,
    "output": 8.900000000000001e-07
  },
  "family": "deepseek"
}
