{
  "last_updated": 1793244704,
  "supported_protocols": [
    "openai"
  ],
  "model_id": "fireworks_ai/accounts/fireworks/models/glm-5p3",
  "canonical_model": "glm-5p3",
  "family": "glm",
  "version": "5.3",
  "capabilities": [
    "text",
    "tool_use",
    "reasoning"
  ],
  "max_input_tokens": 1048576,
  "context_window": 1048576,
  "max_output_tokens": 128000,
  "official": false,
  "thinking_supported": true,
  "thinking_toggleable": true,
  "price": {
    "currency": "USD",
    "input": 1.4e-06,
    "output": 4.4e-06
  }
}
