{
  "last_updated": 1790859418,
  "supported_protocols": [
    "openai"
  ],
  "model_id": "openrouter/google/gemini-2.5-flash-lite:batch",
  "display_name": "Google: Gemini 2.5 Flash Lite (batch)",
  "canonical_model": "gemini-2.5-flash-lite:batch",
  "family": "gemini",
  "version": "2.5",
  "capabilities": [
    "text",
    "vision",
    "tool_use",
    "reasoning"
  ],
  "max_input_tokens": 1048576,
  "context_window": 1048576,
  "max_output_tokens": 65535,
  "official": false,
  "thinking_supported": true,
  "thinking_toggleable": true,
  "price": {
    "input": 5e-08,
    "output": 2e-07
  }
}
