{
  "last_updated": 1793244705,
  "supported_protocols": [
    "openai"
  ],
  "model_id": "xai/grok-4.20-0309-reasoning",
  "display_name": "Grok 4.20 0309 Reasoning",
  "canonical_model": "grok-4.20-0309-reasoning",
  "family": "grok",
  "version": "4.20",
  "capabilities": [
    "text",
    "vision",
    "tool_use",
    "reasoning"
  ],
  "max_input_tokens": 1000000,
  "context_window": 1000000,
  "max_output_tokens": 1000000,
  "official": false,
  "thinking_supported": true,
  "thinking_toggleable": true,
  "price": {
    "currency": "USD",
    "input": 1.25e-06,
    "output": 2.5e-06
  }
}
