{
  "last_updated": 1793244705,
  "supported_protocols": [
    "anthropic",
    "gemini",
    "openai"
  ],
  "model_id": "xai/grok-build-0.1",
  "display_name": "Grok Build 0.1",
  "canonical_model": "grok-build-0.1",
  "family": "grok",
  "version": "0.1",
  "capabilities": [
    "text"
  ],
  "official": true,
  "thinking_supported": true,
  "thinking_toggleable": true,
  "price": {
    "currency": "USD",
    "input": 1.08e-06,
    "output": 2.16e-06
  },
  "max_input_tokens": 256000,
  "context_window": 256000,
  "max_output_tokens": 8000
}
