{
  "last_updated": 1790859415,
  "supported_protocols": ["anthropic", "gemini", "openai"],
  "model_id": "meta-llama/llama-3.2-3b-instruct:free",
  "canonical_model": "llama-3.2-3b-instruct:free",

  "family": "llama",  "display_name": "Llama 3.2 3B Instruct (free)",
  "capabilities": [],
  "official": false,
  "thinking_supported": false,
  "thinking_toggleable": false,
  "price": {
    "input": 2e-08,
    "output": 2e-08
  }
}
