{
  "last_updated": 1793244703,
  "supported_protocols": [
    "gemini"
  ],
  "model_id": "google/gemma-4-26b-a4b-it-maas",
  "canonical_model": "gemma-4-26b-a4b-it-maas",
  "family": "gemma",
  "version": "4",
  "capabilities": [
    "text"
  ],
  "max_input_tokens": 262144,
  "max_output_tokens": 128000,
  "context_window": 262144,
  "official": true,
  "price": {
    "currency": "USD",
    "input": 1.5e-07,
    "output": 6e-07,
    "cache_read": 0
  }
}
