{
  "model_id": "meta-llama/llama-3.1-70b-instruct",
  "display_name": "Meta: Llama 3.1 70B Instruct",
  "canonical_model": "llama-3.1-70b-instruct",
  "family": "llama",
  "version": "3.1",
  "max_input_tokens": 131072,
  "context_window": 131072,
  "official": true,
  "max_output_tokens": 16384,
  "thinking_supported": false,
  "thinking_toggleable": false,
  "price": {
    "currency": "USD",
    "input": 4e-07,
    "output": 4e-07
  },
  "last_updated": 1793244705,
  "supported_protocols": [
    "anthropic",
    "openai"
  ],
  "capabilities": [
    "text"
  ]
}
