{
  "last_updated": 1793244704,
  "supported_protocols": [
    "openai"
  ],
  "model_id": "fal_ai/low/1920-x-1080/openai/gpt-image-2.5/sunburst/text-to-image",
  "display_name": "GPT Image 2.5 Sunburst",
  "canonical_model": "gpt-image-2.5-sunburst",
  "family": "gpt",
  "version": "2.5",
  "capabilities": [
    "text_to_image"
  ],
  "official": false,
  "thinking_supported": false,
  "thinking_toggleable": false,
  "price": {
    "currency": "USD",
    "unit": "image",
    "unit_price": 0.00441
  }
}
