{
  "last_updated": 1793244704,
  "supported_protocols": [
    "openai"
  ],
  "model_id": "glm-4.5v",
  "display_name": "GLM-4.5V",
  "canonical_model": "glm-4.5v",
  "family": "glm",
  "version": "4.5",
  "thinking_supported": true,
  "thinking_toggleable": true,
  "capabilities": [
    "text",
    "vision",
    "tool_use",
    "reasoning"
  ],
  "max_input_tokens": 128000,
  "max_output_tokens": 32000,
  "context_window": 128000,
  "official": false,
  "price": {
    "currency": "USD",
    "input": 6e-07,
    "output": 1.8e-06,
    "cache_read": 5.555555555555556e-08
  }
}
