{
  "last_updated": 1793244702,
  "supported_protocols": [
    "anthropic",
    "gemini",
    "openai"
  ],
  "model_id": "cc-kimi-k2-instruct",
  "canonical_model": "cc-kimi-k2-instruct",
  "version": "2",
  "family": "kimi",
  "display_name": "CC Kimi K2 Instruct",
  "capabilities": [],
  "official": false,
  "thinking_supported": false,
  "thinking_toggleable": false,
  "price": {
    "currency": "USD",
    "input": 1.1e-06,
    "output": 3.3e-06
  }
}
