{
  "last_updated": 1793244702,
  "supported_protocols": [
    "anthropic",
    "gemini",
    "openai"
  ],
  "model_id": "wan2.5-i2v-preview",
  "canonical_model": "wan2.5-i2v-preview",
  "display_name": "Wan2.5 I2v Preview",
  "version": "2.5",
  "family": "wan",
  "capabilities": [
    "vision",
    "text_to_video",
    "image_to_video",
    "video"
  ],
  "official": false,
  "thinking_supported": false,
  "thinking_toggleable": false,
  "price": {
    "currency": "USD",
    "unit": "second",
    "unit_price": 0
  }
}
