{
  "last_updated": 1793244702,
  "supported_protocols": [
    "anthropic",
    "gemini",
    "openai"
  ],
  "model_id": "alicloud-minimax-m2.5",
  "canonical_model": "MiniMax-M2.5",
  "capabilities": [
    "text"
  ],
  "context_window": 204800,
  "display_name": "Alicloud Minimax M2.5",
  "version": "2.5",
  "family": "minimax",
  "official": false,
  "thinking_supported": true,
  "thinking_toggleable": false,
  "price": {
    "currency": "USD",
    "input": 2.876e-07,
    "output": 1.1504e-06,
    "cache_read": 5.752e-08
  }
}
